{
  "$schema": "https://json-schema.org/draft/2020-12/schema",
  "type": "object",
  "required": [
    "default_allow",
    "rules"
  ],
  "properties": {
    "default_allow": {
      "type": "boolean"
    },
    "nad_groups": {
      "type": "object",
      "additionalProperties": {
        "type": "object",
        "properties": {
          "cidrs": {
            "type": "array",
            "items": { "type": "string" },
            "description": "CIDR ranges (IPv4 or IPv6) whose source IPs belong to this NAD group."
          }
        },
        "additionalProperties": false
      },
      "description": "Named NAD groups mapping a label to CIDR membership criteria. Referenced from rule nad_groups fields."
    },
    "enable_groups": {
      "type": "object",
      "patternProperties": {
        "^([0-9]|1[0-5])$": {
          "type": "array",
          "items": { "type": "string" }
        }
      },
      "additionalProperties": false,
      "description": "Privilege-escalation gating: maps a requested privilege level (\"0\"-\"15\") to the ICAM/LDAP groups permitted to `enable` to it. When empty, enable is allowed for any authenticated user. Privilege is hierarchical: a group cleared for a higher level may also enable to lower levels."
    },
    "shell_start": {
      "type": "object",
      "additionalProperties": {
        "type": "array",
        "items": {
          "type": "string"
        }
      },
      "description": "Shell-start attributes keyed by username (case-insensitive)."
    },
    "shell_start_groups": {
      "type": "object",
      "additionalProperties": {
        "type": "array",
        "items": {
          "type": "string"
        }
      },
      "description": "Shell-start attributes keyed by group name (case-insensitive). Checked when the user has no entry in shell_start; first matching group wins."
    },
    "device_flow_exclude_users": {
      "type": "array",
      "items": {
        "type": "string"
      },
      "description": "Usernames or glob patterns (single * wildcard) that bypass RFC 8628 device flow and use password auth instead. Case-insensitive. Use for service accounts that cannot complete browser authentication (e.g. 'svc-tenable', 'svc-*')."
    },
    "ascii_prompts": {
      "type": "object",
      "properties": {
        "username": {
          "type": "string"
        },
        "password": {
          "type": "string"
        }
      },
      "additionalProperties": false
    },
    "ascii_user_prompts": {
      "type": "object",
      "additionalProperties": {
        "type": "string"
      },
      "description": "Per-user overrides for username prompt; keys are usernames (case-insensitive)."
    },
    "ascii_password_prompts": {
      "type": "object",
      "additionalProperties": {
        "type": "string"
      },
      "description": "Per-user overrides for password prompt; keys are usernames (case-insensitive)."
    },
    "ascii_port_prompts": {
      "type": "object",
      "additionalProperties": {
        "type": "string"
      },
      "description": "Per-port overrides for username prompt; keys are port strings."
    },
    "ascii_remaddr_prompts": {
      "type": "object",
      "additionalProperties": {
        "type": "string"
      },
      "description": "Per-remote-address overrides for username prompt; keys are rem_addr strings."
    },
    "allow_raw_server_msg": {
      "type": "boolean",
      "description": "When false, auth replies carrying raw server_msg bytes will be blocked/errored."
    },
    "raw_server_msg_allow_prefixes": {
      "type": "array",
      "items": {
        "type": "string"
      },
      "description": "Optional list of hex prefixes that are allowed for raw server_msg; if set, raw messages must match one of these prefixes."
    },
    "raw_server_msg_deny_prefixes": {
      "type": "array",
      "items": {
        "type": "string"
      },
      "description": "Optional list of hex prefixes that are denied for raw server_msg; deny takes precedence over allow."
    },
    "raw_server_msg_user_overrides": {
      "type": "object",
      "additionalProperties": {
        "type": "object",
        "properties": {
          "allow": {
            "type": "boolean"
          },
          "allow_prefixes": {
            "type": "array",
            "items": {
              "type": "string"
            }
          },
          "deny_prefixes": {
            "type": "array",
            "items": {
              "type": "string"
            }
          },
          "allow_services": {
            "type": "array",
            "items": {
              "type": "integer",
              "minimum": 0,
              "maximum": 255
            }
          },
          "allow_actions": {
            "type": "array",
            "items": {
              "type": "integer",
              "minimum": 0,
              "maximum": 255
            }
          }
        },
        "additionalProperties": false
      },
      "description": "Per-user overrides for raw server_msg enforcement; keys are usernames (case-insensitive)."
    },
    "ascii_messages": {
      "type": "object",
      "properties": {
        "success": {
          "type": "string"
        },
        "failure": {
          "type": "string"
        },
        "abort": {
          "type": "string"
        }
      },
      "additionalProperties": false
    },
    "rules": {
      "type": "array",
      "items": {
        "type": "object",
        "required": [
          "id",
          "priority",
          "effect",
          "pattern"
        ],
        "properties": {
          "id": {
            "type": "string"
          },
          "priority": {
            "type": "integer"
          },
          "effect": {
            "type": "string",
            "enum": [
              "allow",
              "deny"
            ]
          },
          "pattern": {
            "type": "string"
          },
          "users": {
            "type": "array",
            "items": {
              "type": "string"
            },
            "description": "Usernames (case-insensitive) this rule applies to. If absent, rule applies to all users."
          },
          "groups": {
            "type": "array",
            "items": {
              "type": "string"
            },
            "description": "Group names (case-insensitive) this rule applies to. If absent, rule applies to all groups."
          },
          "nad_groups": {
            "type": "array",
            "items": {
              "type": "string"
            },
            "description": "NAD group names this rule applies to. If absent, rule applies to all NADs. Groups must be defined in the top-level nad_groups map."
          },
          "schedule": {
            "type": "object",
            "properties": {
              "days": {
                "type": "array",
                "items": {
                  "type": "string",
                  "enum": ["mon","tue","wed","thu","fri","sat","sun","weekdays","weekends",
                           "monday","tuesday","wednesday","thursday","friday","saturday","sunday"]
                },
                "description": "Days of the week this rule is active (UTC). Empty = all days. Accepts 3-letter names, full names, or 'weekdays'/'weekends'."
              },
              "hours": {
                "type": "string",
                "pattern": "^([01]?[0-9]|2[0-3]):[0-5][0-9]-([01]?[0-9]|2[0-3]):[0-5][0-9]$",
                "description": "UTC time range HH:MM-HH:MM during which this rule is active. Ranges wrapping midnight (e.g. '22:00-06:00') are supported."
              }
            },
            "additionalProperties": false,
            "description": "Optional time-based restriction. When present, the rule only fires within the specified UTC day(s) and/or hour range."
          }
        }
      }
    }
  }
}