{
  "default_allow": false,
  "device_flow_exclude_users": ["alice"],
  "shell_start": {
    "alice": ["priv-lvl=15"],
    "bob": ["priv-lvl=1"]
  },
  "ascii_prompts": {
    "username": "Username:",
    "password": "Password:"
  },
  "ascii_user_prompts": {},
  "ascii_password_prompts": {},
  "ascii_port_prompts": {},
  "ascii_remaddr_prompts": {},
  "allow_raw_server_msg": false,
  "ascii_messages": {
    "success": "",
    "failure": "",
    "abort": ""
  },
  "raw_server_msg_allow_prefixes": [],
  "raw_server_msg_deny_prefixes": [],
  "raw_server_msg_user_overrides": {},
  "rules": [
    {
      "id": "allow-show",
      "priority": 10,
      "effect": "allow",
      "pattern": "show(\\s+.*)?"
    }
  ]
}
